id,tweet,subtask_a,tweet_cleaned
24430,"#Florencehurricane 72 HOURS OF SUSTAINED LETHAL CYCLONIC FORCES, ONLY TO A FEW HOURS TO IMPACT TO  #NorthCarolina #SouthCarolina, AND #Georgia... DON'T BE STUPID... GET AWAY FROM THESE AREAS... @USER @USER #Florence Sep 12 12:13 PM #Nyc #Miami #Houston #Chicago #Nj #Ca #La URL",NOT,72 hours of sustained lethal cyclonic forces only to a few hours to impact to    and  dont be stupid get away from these areas    sep 12 1213 pm
19563,"#Antifa #UKLabour, #FBPE, #SUTR  Pay Attention!  This is what #ForBritain is fighting against - you? URL",NOT,pay attention  this is what  is fighting against  you
19836,@USER He is a expert on NI now &amp; blocks anyone that challenges his views--he just wants his view heard-he has obsessive love for EU-,NOT,he is a expert on ni now  blocks anyone that challenges his viewshe just wants his view heardhe has obsessive love for eu
31033,#Antifa demo in memory of #KillahP. #Greece URL,NOT,demo in memory of
70051,@USER These are all  coranated attacks from idiot loons! They will get worse much worse before the election! Can u imagine idiots who want to get rid of the economy and their 401 along with interest rates just because he is not a polished politician? Idiots!,OFF,these are all  coranated attacks from idiot loons they will get worse much worse before the election can u imagine idiots who want to get rid of the economy and their 401 along with interest rates just because he is not a polished politician idiots
73642,@USER @USER Awwww she is so stinking cute! How old is she now?,OFF,awwww she is so stinking cute how old is she now
10727,"#Benghazi  #Haiti  #UraniumOne  #SethRich What more does the justice department need? No double standards! Just because you're Rich and Powerful doesn't mean you can rob, seal and murder! #DrainTheSwamp  #HillaryForPrison  #VoteRed #MAGA URL",OFF,what more does the justice department need no double standards just because youre rich and powerful doesnt mean you can rob seal and murder
73442,"#Black_Eyed_Peas Tackle Gun Control, Social Justice on New Song ‘Big Love’: Single highlights group's first album in eight years, 'Masters of the Sun' URL URL",NOT,tackle gun control social justice on new song ‘big love’ single highlights groups first album in eight years masters of the sun
59758,#Censorship  Awake yet?  Ask yourself why these conservatives are being censored? #WalkAway URL,NOT,awake yet  ask yourself why these conservatives are being censored
11781,"You didnt have to beat him up like that... all he said was you are looking so delicious."" You say as you clean up his bruised knuckles. ""Nobody talks to my woman that way...except me."" He pulls you on to his lap.  ""Do you want me to kiss it and make it feel better?"" You tease.+ URL",NOT,you didnt have to beat him up like that all he said was you are looking so delicious you say as you clean up his bruised knuckles nobody talks to my woman that wayexcept me he pulls you on to his lap  do you want me to kiss it and make it feel better you tease
11645,#JoinTheFight    Join the fight against American Communists... Democrats  and  Liberals have taken this crap to the edge and there is no coming back. They are  openly promoting the Destruction of  AMERICA.  #JoinTheFightAgainstCommunism URL,OFF,join the fight against american communists democrats  and  liberals have taken this crap to the edge and there is no coming back they are  openly promoting the destruction of  america
91116,#Art #ArtistsOnTwitter #Soul #GoodBusiness #Entrepreneur #Success #Excellence #WomanInBusiness #MindBlowing #Quotestoliveby “Be gentle with yourself. You are a child of the universe no less than the trees and the stars; you       have a right to be here.” by Max Ehrmann URL,NOT,“be gentle with yourself you are a child of the universe no less than the trees and the stars you       have a right to be here” by max ehrmann
86437,"#ICYMI: Welcome Anna Grey Barbour to our Women’s Volleyball Team! Anna is a 2018 Terry Sanford High School graduate. She is studying dental hygiene at our college. We’re proud to make you a Trojan, Anna. Good luck this season! #BlackNGold #Trojans 🏐🖤💛 URL",NOT,welcome anna grey barbour to our women’s volleyball team anna is a 2018 terry sanford high school graduate she is studying dental hygiene at our college we’re proud to make you a trojan anna good luck this season
86268,#BiggBossTamil #BiggBossTamil2 #BiggBoss2Tamil intha #Aishwarya va kuda manichirlam ana intha #Yashika 😡😡 The biggest reason for every fight in BB house. Yet our foolish people support her just because she is doing Tasks. URL,NOT,intha  va kuda manichirlam ana intha   the biggest reason for every fight in bb house yet our foolish people support her just because she is doing tasks
21643,#TOTALLYBLOGGING - Want to know how to keep your focus when you are blogging? It's easier said than done at the start so take a look at what you can do to stop quitting! URL #ukbloggers #fbloggers #bbloggers #lbloggers URL,NOT,want to know how to keep your focus when you are blogging its easier said than done at the start so take a look at what you can do to stop quitting
72274,@USER @USER has stated that any talk of Zionist involvement in 9/11 is metaphysical masturbation because he is a disinformation agent taking advantage of people of lesser intellect. He should be ashamed of himself but he’s not because he’s #Zionel,OFF,has stated that any talk of zionist involvement in 911 is metaphysical masturbation because he is a disinformation agent taking advantage of people of lesser intellect he should be ashamed of himself but he’s not because he’s
95198,"#UPDATE: New projections state Hurricane #Florence may now travel down the coastline with the entire NC/SC coast possibly suffering #Florence's deadly storm surge greatly increasing the seriousness of the rain/wind in South Carolina and surrounding areas, even possibly Georgia URL",NOT,new projections state hurricane  may now travel down the coastline with the entire ncsc coast possibly suffering s deadly storm surge greatly increasing the seriousness of the rainwind in south carolina and surrounding areas even possibly georgia
31550,"#Liberals are like, Economics? I don't even know what gender I am.""""",NOT,are like economics i dont even know what gender i am
21524,"#Khaleesi kinda watching #HIAC ! Wtf does she think she is, a person? Pffft pathetic URL",OFF,kinda watching   wtf does she think she is a person pffft pathetic
84579,And🤷🏽‍♂️ females b on the same shit URL,OFF,and females b on the same shit
26291,#Brexit #UKLabour #Labour #Conservatives #PlaidCymru #Greens #Politics #EU URL  - POLL,NOT,poll
72424,"#BreakingNews, via NYT The New York Times URL",NOT,via nyt the new york times
28744,#HCHottestCeleb   Round of 32 Match 12  Scarlett Johansson   V.S  Emma Stone   POLL BELOW URL,NOT,round of 32 match 12  scarlett johansson   vs  emma stone   poll below
59961,"#Sugardaddy Retweet if you are under 30 and you want 400$ daily USA,Canada and UK only #sugarbabyneeded #sugarbabywanted #findom #sugarbaby #Canada",NOT,retweet if you are under 30 and you want 400 daily usacanada and uk only
59519,#DeclassifyDocuments I love watching liberals like Maria squirm. #Outnumbered,OFF,i love watching liberals like maria squirm
51386,"#PoliticsInFocus Look Donald! You are only a duck, stop patronizing me! URL",OFF,look donald you are only a duck stop patronizing me
76052,#naturephotography. #nature. #birds #wild in #Wisconsin #photography. #picoftheday. #pics #fridaymotivation. #fridayfeeling. #instagramers. I hope you are having an #amazing day URL,NOT,in        i hope you are having an  day
14837,#CarolineForbes You are needed to help with the posted SL. DM me to Audition.,NOT,you are needed to help with the posted sl dm me to audition
57295,"#WCW to @USER   I mean hey, she is a great friend and I am more than happy to help with missions and anything else she might need!",NOT,to    i mean hey she is a great friend and i am more than happy to help with missions and anything else she might need
74610,"@USER @USER that would have just offbalanced him   he did exactly what was smart, basic grappling: it might have been all instinct but the antifa used basic grappling:  Cross side collar to snap down, then stepping out of his weak single leg  attempt",NOT,that would have just offbalanced him   he did exactly what was smart basic grappling it might have been all instinct but the antifa used basic grappling  cross side collar to snap down then stepping out of his weak single leg  attempt
55653,"#Cancer  Hate crime isn't an actual crime. If there's a victim, then it's just called crime. (Malum in se)  Hate"" crime is socially engineered programming to control people's behavior, just like gun control.  #ChangeMyMind URL",NOT,hate crime isnt an actual crime if theres a victim then its just called crime malum in se  hate crime is socially engineered programming to control peoples behavior just like gun control
10918,#CarbonTax works and will put tons more money BACK INTO Canadian pockets.  .@USER  .@USER  .@USER .@USER  Part of why Trudeau won in 2015 was campaigning on a national carbon tax. Conservatives died then. They want another death in 2019...we will oblige. URL,OFF,works and will put tons more money back into canadian pockets         part of why trudeau won in 2015 was campaigning on a national carbon tax conservatives died then they want another death in 2019we will oblige
57541,Antonia Evans was either sex trafficked or cremated.,OFF,antonia evans was either sex trafficked or cremated
55318,#Repost thesavoyshow with get_repost ・・・ #MarkKnight Says he is not a racist after drawing a racist picture of #SerenaWilliams .. Do y’all believe him or nah?⤵️ URL,NOT,thesavoyshow with getrepost   says he is not a racist after drawing a racist picture of   do y’all believe him or nah
80965,@USER The worrying thing is that she is teaching our young adults.,NOT,the worrying thing is that she is teaching our young adults
14051,#WalkAway #DemocratSocialists #Socialists #Socialism #Resist #Communists #Antifa #Cult #Crazy #Insane #mentalillness #EmptyHeaded #BernieSanders #Venezuela 42 TRILLION in NEW TAXES #AlexandriaOcasioCortez #OcasioCortez #EndorsementFail #MissVenezuala2018 Alexandria Ocasio Cortez URL,NOT,42 trillion in new taxes     alexandria ocasio cortez
25125,#TheView stormy was in trapped by a dollar bill in her face poor pornstar but no worries the Democratic Party she is the leader of,OFF,stormy was in trapped by a dollar bill in her face poor pornstar but no worries the democratic party she is the leader of
81974,"#ProudAlumnus Keep up the great work, @USER Don't forget you are under GREAT leadership, so take some time to soak in the skills they aim to teach. URL",NOT,keep up the great work  dont forget you are under great leadership so take some time to soak in the skills they aim to teach
76797,#WILDCARDWEDNESDAY #MAXDRIVEWILDCARDWEDNESDAY You Are #OnAirWithShine #NP HAPPIER  - @USER FT @USER  On The #MaxDrive w.@USER the #RadioENCHANTRESS,NOT,you are   happier    ft   on the  w the
57494,@USER He is off the deep end. This calls for an intervention,NOT,he is off the deep end this calls for an intervention
49441,#CNBC what's go talk about the gender gap in silicon valley but won't talk about the gap between conservatives and #emocrats and the #bias,NOT,whats go talk about the gender gap in silicon valley but wont talk about the gap between conservatives and  and the
78266,$500 Million Funding Competition for US cities That’s nice. ⁦@USER  URL,NOT,500 million funding competition for us cities that’s nice ⁦
31401,@USER She Is A ChiCom Spy..... #ClubGITMO,NOT,she is a chicom spy
80020,"#Repost @USER ・・・ We can’t forget to give props to Naomi Osaka!! 🏆🎾 She played against her idol and won. In someways the win has been overshadowed, but she is so humbled in her… URL",NOT,we can’t forget to give props to naomi osaka  she played against her idol and won in someways the win has been overshadowed but she is so humbled in her…
61295,And these entertainment agencies just gonna have to be an ass about it. URL,OFF,and these entertainment agencies just gonna have to be an ass about it
45518,@USER He is obviously getting suspended. He is not an asset for anyone,NOT,he is obviously getting suspended he is not an asset for anyone
53351,"#Trump Really, everything Trump does is another piece of evidence for obstruction of justice. He is a talking crime machine.",OFF,really everything trump does is another piece of evidence for obstruction of justice he is a talking crime machine
51610,#Canada - EXCLUSIVE: #Trudeau #Liberals leave $372M meant to help veterans unspent since taking office URL,NOT,exclusive   leave 372m meant to help veterans unspent since taking office
26758,@USER @USER ...than why did you show us how hot she is ?,NOT,than why did you show us how hot she is
30718,@USER @USER @USER You have yet to answer what *realistically enforceable* gun control law would *prevent* the tragedies without violating Due Process and HIPAA...,NOT,you have yet to answer what realistically enforceable gun control law would prevent the tragedies without violating due process and hipaa
25463,"#DisarmThem? This goes to show how moronic Antifa types are, because this is a good way to encourage some dumbass to rightfully get speedrocked. Open carry users practice weapon retention. Gun grabs will go very badly for you if you try. You will get shot, so don't do it. #2A URL",OFF,this goes to show how moronic antifa types are because this is a good way to encourage some dumbass to rightfully get speedrocked open carry users practice weapon retention gun grabs will go very badly for you if you try you will get shot so dont do it
82558,#MAGA  ... got any ideas how she could have done it? URL,NOT,got any ideas how she could have done it
85613,#ChristineBFord #LiberalsAreDesperate @USER every time liberals don't get there way they cry racism or sexual assault. Hard to believe,OFF,every time liberals dont get there way they cry racism or sexual assault hard to believe
36875,"(URL You can't summarize the rankings of a game mode in just one picture"" URL",NOT,you cant summarize the rankings of a game mode in just one picture
86142,#Learn from it and become #better instead of remaining #stuck in it and become #bitter. #CLifeClearly #CLifeThryve #AboutThatLife #CLifeMacon,NOT,from it and become  instead of remaining  in it and become
87711,"#KamalaHarris may run for President in 2020, but will never be #POTUS. Sadly, she is guaranteed a leadership role in politics, much like #DianneFeinstein, that’s reality in liberal California. Ask #NancyPelosi! #ChuckSchumer #CNN #MSNBC",NOT,may run for president in 2020 but will never be  sadly she is guaranteed a leadership role in politics much like  that’s reality in liberal california ask
51626,Levi Strauss has “never been afraid to take an unpopular stand to support a greater good.” '  What about when they shut down all manufacturing in America?  That wasn't even a news story when it happened. Maybe they're right; it wasn't unpopular.  URL,NOT,levi strauss has “never been afraid to take an unpopular stand to support a greater good”   what about when they shut down all manufacturing in america  that wasnt even a news story when it happened maybe theyre right it wasnt unpopular
59423,#repost @USER is giving a word with this jacket. #preach #saynotofuckboys #dontgiveyourmagictomuggles URL,NOT,is giving a word with this jacket
80555,#Emmys sooo lovely I love the dress colour and the design looks like fairy tales and she is very tender 🌬 URL,NOT,sooo lovely i love the dress colour and the design looks like fairy tales and she is very tender
85830,"#CHANGE  I remember past administrations chant was change"".  There was no change carried the same baton and did nothing.  This POTUS is making the changes.  He does what he says.  So far for the better.   I like.  But swampies, liberals, lefties just hatin. Don't be hatin""",NOT,i remember past administrations chant was change  there was no change carried the same baton and did nothing  this potus is making the changes  he does what he says  so far for the better   i like  but swampies liberals lefties just hatin dont be hatin
29102,An open letter to Mac Miller URL,NOT,an open letter to mac miller
85886,"#CincinnatiEnquirer steps into #Gun Control FINALLY. Took a #MassShhoting on their damn door step for their #editors to wake up, but better late than never. URL",OFF,steps into  control finally took a  on their damn door step for their  to wake up but better late than never
54621,!!!!bitch i’m fucking coming back URL,OFF,bitch i’m fucking coming back
80397,#Liberals Are Reaching Peak Desperation To Call On #PhillipRuddock To Talk With #Turnbull To Convince Him To Help with #WentworthVotes 18 Sept 2018  @USER #Auspol #LNP #NSWpol @USER  @USER @USER #LNPMemes URL,OFF,are reaching peak desperation to call on  to talk with  to convince him to help with  18 sept 2018
76937,@USER Most of them in Chicago where there is STRICTER gun control. IT DOESNT WORK!,NOT,most of them in chicago where there is stricter gun control it doesnt work
68875,$uicideboy$ ON HALLOWEEN its aboout to get sooooo FUCKING spooky,OFF,uicideboy on halloween its aboout to get sooooo fucking spooky
89591,@USER He does. And I'm glad he always goes out on something reckless to show who he is going out and coming back everytime! Jeff is the best!!!,NOT,he does and im glad he always goes out on something reckless to show who he is going out and coming back everytime jeff is the best
67926,"#Democrat controlled city with strict gun control laws and @USER wants to blame the #GOP Um, isn’t it you rich #Democrats trying to keep the blacks in poverty? #WalkAway URL",OFF,controlled city with strict gun control laws and  wants to blame the  um isn’t it you rich  trying to keep the blacks in poverty
41588,@USER Got to love that the people making the laws tend to know nothing about the subject they're making the law for. You should hear some of the gun control laws people try to pass here in the states.,OFF,got to love that the people making the laws tend to know nothing about the subject theyre making the law for you should hear some of the gun control laws people try to pass here in the states
18091,@USER @USER @USER @USER @USER Same here😢😢. I can't hear what she is saying,NOT,same here i cant hear what she is saying
56205,@USER @USER @USER @USER Penny believes that she is so intelligent that she just knows he will.....I think she may be the smartest Canadian.....ever. Canadians are fun to watch. They have to get on Twitter in the US to find anyone with an opinion. I like RUSH...and hockey,NOT,penny believes that she is so intelligent that she just knows he willi think she may be the smartest canadianever canadians are fun to watch they have to get on twitter in the us to find anyone with an opinion i like rushand hockey
24467,#SandraOh...OH how I love that you brought your parents...they (and you) are the epitome of grace and beauty!,NOT,oh how i love that you brought your parentsthey and you are the epitome of grace and beauty
47245,#HealingYourself is connected with #healingothers.,NOT,is connected with
32851,#ChristineBlaseyFord needs to testify under oath before anything. The claims should be investigated as far as any of these claims can be investigated. If/ when it comes down to her word vs. #Kavanaugh's he should be approved as soon as possible. Full stop.  #MAGA #QAnon,NOT,needs to testify under oath before anything the claims should be investigated as far as any of these claims can be investigated if when it comes down to her word vs s he should be approved as soon as possible full stop
86982,#Maga @USER   Antifa website instructing how to hurt multiple police officers and how to cross border.  URL URL,NOT,antifa website instructing how to hurt multiple police officers and how to cross border
95247,"#NationalDayofEncouragement #EncouragementDare Therefore #encourage one another and build each other up, just as in fact you are doing!! #Thessalonians #scripture #verse To donate, go to our website(link in bio!), call 404-478-9794 or email donate@USER #community URL",NOT,therefore  one another and build each other up just as in fact you are doing    to donate go to our websitelink in bio call 4044789794 or email donate
74211,94-year-old Bletchley Park veteran: I helped defeat the Nazis in 1941 and I'm ready to fight fascism again now URL,NOT,94yearold bletchley park veteran i helped defeat the nazis in 1941 and im ready to fight fascism again now
51948,@USER #WalkAWayFromCatholicism it is a corrupt to the core and become a giant autocratic pedophile ring.,OFF,it is a corrupt to the core and become a giant autocratic pedophile ring
28196,"#CALIFORNIA PATRIOTS... especially those in #CA21  Obama/Soros are attempting to take this House seat to get control of Congress.  Say no to TJ Cox.  He is a shill Candidate fronted by the dastardly duo.  Please get out and vote David Valadao for House, Dist 21! Follow @USER URL",OFF,patriots especially those in   obamasoros are attempting to take this house seat to get control of congress  say no to tj cox  he is a shill candidate fronted by the dastardly duo  please get out and vote david valadao for house dist 21 follow
71881,#noshadenotea but like if you are in community college and your parents still have to pick you up and drop you off. You need to get your life together omg,NOT,but like if you are in community college and your parents still have to pick you up and drop you off you need to get your life together omg
50376,- When she takes her nigga name out her bio. URL,OFF,when she takes her nigga name out her bio
64161,@USER Exactly it’s bc slick woods has that unconventional look that she’s who she is yea she ain’t attractive to most of us but that shit don’t matter @ all lol,NOT,exactly it’s bc slick woods has that unconventional look that she’s who she is yea she ain’t attractive to most of us but that shit don’t matter  all lol
45304,#ArrestGeorgeSoros He Funds #DomesticTerrorists #Antifa URL,OFF,he funds
22248,#Interesting  Has she gone through any kind of background check similar to the 6 #FBI background checks that #JudgeKavanaugh has? URL,NOT,has she gone through any kind of background check similar to the 6  background checks that  has
27228,#Conservatives Govt have run up debt in spite of austerity cuts while the rich have doubled their wealth. #inequality  URL via @USER,OFF,govt have run up debt in spite of austerity cuts while the rich have doubled their wealth    via
57326,#CrowderConfronts continues to expose that the SJW bullies are paper tigers when conservatives fight back with truth and facts. #dontbeafraid #confrontwithtruth URL,OFF,continues to expose that the sjw bullies are paper tigers when conservatives fight back with truth and facts
97729,2x the fun y'all URL,NOT,2x the fun yall
24957,"... Antifa comrades miss the nuance of (a lot don't, but still, people, you know):  It's not that 45 is a white nationalist,"" as that's a very specific community. It's that he uses the same white supremacist rhetoric employed by WNs, which gives him dangerous company with them..""",NOT,antifa comrades miss the nuance of a lot dont but still people you know  its not that 45 is a white nationalist as thats a very specific community its that he uses the same white supremacist rhetoric employed by wns which gives him dangerous company with them
68774,#BeckyLynch is beautiful one of the few women in wrestling that absolutely need no work done at all. She's absolutely beautiful just the way she is. Doesn't need giant boobs or a fake booty. @USER is just simply amazing #HIAC,NOT,is beautiful one of the few women in wrestling that absolutely need no work done at all shes absolutely beautiful just the way she is doesnt need giant boobs or a fake booty  is just simply amazing
43350,@USER @USER @USER Gun Control is nothing but people control. The left wants gun control ONLY because they do NOT want us little guys armed &amp; able to defend ourselves. Makes it harder to get us behind barbed-wire fences as they saw in North Korea.,NOT,gun control is nothing but people control the left wants gun control only because they do not want us little guys armed  able to defend ourselves makes it harder to get us behind barbedwire fences as they saw in north korea
41709,"#ALERT  A win for the Progressive Conservatives.   The Ontario Court of Appeal has granted a stay of #Bill5,  which is to cut the number of Toronto city councillors from 47 to 25.",NOT,a win for the progressive conservatives   the ontario court of appeal has granted a stay of   which is to cut the number of toronto city councillors from 47 to 25
71063,$25 Amazon/PP-1-WW-Murder and Food Porn: A Northwest Cozy Mystery #8-Dianne Harman-Ends 10/2 URL,NOT,25 amazonpp1wwmurder and food porn a northwest cozy mystery dianne harmanends 102
92516,#WCW #WCE @USER  It’s your special day of the week again. I really miss you and I’m looking forward to see you soon. Don’t forget that I love you. I love you with all my heart because you are my heart! ❤️ URL,NOT,it’s your special day of the week again i really miss you and i’m looking forward to see you soon don’t forget that i love you i love you with all my heart because you are my heart
85100,#BarbieDreamsVIDEO @USER   I love you❤ But i fux with you even more as roman i feel like...you are roman just actin' like nicki!😍  Dimelo papi papi!,NOT,i love you but i fux with you even more as roman i feel likeyou are roman just actin like nicki  dimelo papi papi
