id,tweet,subtask_a,tweet_cleaned
15923,"#WhoIsQ #WheresTheServer #DumpNike #DECLASFISA Democrats Support Antifa, Muslim Brotherhood, MS13, ISIS, Pedophilia, Child Trafficking, Taxpayer Funded Abortion’s, Election Fraud, Sedition And Treason!!! #LockThemAllUp #WWG1WGA #QAnon ⁦@USER URL",OFF,democrats support antifa muslim brotherhood ms13 isis pedophilia child trafficking taxpayer funded abortion’s election fraud sedition and treason    ⁦
27014,"#ConstitutionDay is revered by Conservatives, hated by Progressives/Socialist/Democrats that want to change it.",NOT,is revered by conservatives hated by progressivessocialistdemocrats that want to change it
30530,"#FOXNews #NRA #MAGA #POTUS #TRUMP #2ndAmendment #RNC #USMC #veterans @USER    @USER @USER @USER @USER   #fakereporting #THESWAMP #dnc #liberals @USER @USER #fakeoutrage @USER  First, it reduces the ca URL",NOT,first it reduces the ca
13876,#Watching #Boomer getting the news that she is still up for parole always makes me smile. #Wentworth Finale...@USER is such a treasure. URL,NOT,getting the news that she is still up for parole always makes me smile  finale is such a treasure
60133,#NoPasaran: Unity demo to oppose the far-right in #London – #antifa #Oct13 — Enough is Enough! URL,OFF,unity demo to oppose the farright in  –   — enough is enough
83681,. . . What the fuck did he do this time?,OFF,what the fuck did he do this time
96874,#RAP is a form of ART! Used to express yourself freely. It does not gv the green light or excuse the behavior of acting like an animal! She is not in the streets of the BX where violence is a way of living. Elevate yourself boo and get on @USER level for longevity! #QUEEN👑,NOT,is a form of art used to express yourself freely it does not gv the green light or excuse the behavior of acting like an animal she is not in the streets of the bx where violence is a way of living elevate yourself boo and get on  level for longevity
65507,@USER Do you get the feeling he is kissing @USER behind so he can humiliate him later?,OFF,do you get the feeling he is kissing  behind so he can humiliate him later
78910,5 Tips to Enhance Audience Connection on Facebook URL @USER #socialmedia #smm URL,NOT,5 tips to enhance audience connection on facebook
46363,#BiggBossTamil janani won the task. She is going to first final list👏👏👏👏,NOT,janani won the task she is going to first final list
68123,#Conservatives - the party of low taxation 😂 #Tories #Tory URL,NOT,the party of low taxation
22452,"𝓒-𝓒𝓮𝓭𝓻𝓪𝓷..  The Nord cannot make a single move, but he is fully aware of what is happening. A chill comes down his spine as a ghostly, rather. . . calm female voice called for him from a corner of the room.  Before he even has time to /attempt/ a response, +",NOT,the nord cannot make a single move but he is fully aware of what is happening a chill comes down his spine as a ghostly rather   calm female voice called for him from a corner of the room  before he even has time to attempt a response
15565,#ConsTOO THE PLACE FOR FED UP CONSERVATIVES !!!,NOT,the place for fed up conservatives
64376,#GreatAwakening #QAnon #PatriotsUnited #WWG1WGA #AreYouAwake  WHEN YOU ARE AWAKE YOU SEE CLEARLY ❤️🧡💛💚  Check out this video URL URL,NOT,when you are awake you see clearly   check out this video
12588,@USER Nigga ware da hits at,OFF,nigga ware da hits at
34263,#StopKavanaugh he is liar like the rest of the #GOP URL,OFF,he is liar like the rest of the
65773,#Dayspromo week of September 17th #days #dool  A coma does things to a gal . Sami: You are going to be ok. Hattie: No thanks to you.  Get her out of here. Before she finishes me off.  Hattie pretends to be Marlena.  The look on Kayla face is priceless. URL,NOT,week of september 17th    a coma does things to a gal  sami you are going to be ok hattie no thanks to you  get her out of here before she finishes me off  hattie pretends to be marlena  the look on kayla face is priceless
95457,#BiggBossTelugu2 Let’s all include @USER in all our tweets...he is the business head of Star Maa network..don’t know if he knows about biggboss team and host hurting audience emotions  #BiggBossTelugu2,NOT,let’s all include  in all our tweetshe is the business head of star maa networkdon’t know if he knows about biggboss team and host hurting audience emotions
24930,"#Dallas#Policewoman kills neighbor in HIS own apartment? WHAT went wrong?? See:Officer who shot man in his own apartment was involved in 2017 shooting of a suspect. “She is devastated,said a Dallas police officer, adds she is ""so so sorry for his family?"" URL",NOT,kills neighbor in his own apartment what went wrong seeofficer who shot man in his own apartment was involved in 2017 shooting of a suspect “she is devastatedsaid a dallas police officer adds she is so so sorry for his family
15938,Always smack URL,NOT,always smack
45712,"#BREAKING: After a week-long trial, a Linn County jury convicted Gregory Davis of First-Degree Murder in connection with the Carrie Davis homicide that took place almost a year ago. URL URL",NOT,after a weeklong trial a linn county jury convicted gregory davis of firstdegree murder in connection with the carrie davis homicide that took place almost a year ago
70840,#Kavanaugh so a wild claim from 36 years ago of groping has evolved into A Rape A Violent Sexual Event by Move URL a Soros based Org. that supports BLM Antifa etc. Unbeievable!,NOT,so a wild claim from 36 years ago of groping has evolved into a rape a violent sexual event by move  a soros based org that supports blm antifa etc unbeievable
53563,"#kznlt Enjouji really is the prototype of my character brand, he is nothing but things that I love all rolled into one horrible package and fed directly into baby me's subconscious.",NOT,enjouji really is the prototype of my character brand he is nothing but things that i love all rolled into one horrible package and fed directly into baby mes subconscious
59432,#SilsilaBadallteRishtonKa tag is filled with appreciation of @USER only....   Never watched this serial but I always wanted appreciation for Aditi... She is underrated since starting of the show... She is worth of all this appreciation.. 👏👏👏,NOT,tag is filled with appreciation of  only   never watched this serial but i always wanted appreciation for aditi she is underrated since starting of the show she is worth of all this appreciation
21454,#Beto #BetoForSenate #BetoORourke #BetoforTX  Willie Nelson laughs at conservatives who are upset with him. URL,NOT,willie nelson laughs at conservatives who are upset with him
83155,#HIAC  Damn Matt Hardy and Randy Orton put on one hell in a cell match!! Woooo!!! I hope he is okay!!,NOT,damn matt hardy and randy orton put on one hell in a cell match woooo i hope he is okay
69576,@USER School shootings aren't controversial. Wanting gun control is.,NOT,school shootings arent controversial wanting gun control is
49139,"@USER @USER Put DeLauro in a police lineup identifying the bag lady"" - she would be picked everytime! She has to be proof either Conn voters are incompetent to vote or she is part of a vast voter fraud conspiracy! No one votes for a woman that gross!""",OFF,put delauro in a police lineup identifying the bag lady  she would be picked everytime she has to be proof either conn voters are incompetent to vote or she is part of a vast voter fraud conspiracy no one votes for a woman that gross
76669,@USER *coffee spit* Spartacus moment?  He never saw the film...,NOT,coffee spit spartacus moment  he never saw the film
58995,"@ ALL FAMILY/FRIENDS , do not tell me  bad shit that your bf/gf did to you just to go right back to them!!!",OFF,all familyfriends  do not tell me  bad shit that your bfgf did to you just to go right back to them
88490,#ChristineBlaseyFord is your #Kavanaugh accuser... #Liberals try this EVERY time... #ConfirmJudgeKavanaugh URL,OFF,is your  accuser  try this every time
77101,"@USER 'Fellow Democrats don't want @USER 🦅🇺🇸 @USER to do well.. it's not about what's best for America. It's purely politics' - Dov Hikind, Democratic NY Assemblyman URL",NOT,fellow democrats dont want    to do well its not about whats best for america its purely politics  dov hikind democratic ny assemblyman
86917,"#osho #quotes via @USER Listen to your being. It is continuously giving you hints. It is a still, small voice. It does not shout at you, that is true. And if you are a little silent you will start feeling your way. Be the person you are. Never try… URL URL",NOT,via  listen to your being it is continuously giving you hints it is a still small voice it does not shout at you that is true and if you are a little silent you will start feeling your way be the person you are never try…
78472,"#YYC @USER  looking hockey players of all ages/abilities for our Humboldt Tribute game Sunday 9/16. Arrive 2pm, dress, participate in our opening ceremony. Contact lindsay.clothier@USER if you are interested! #WePlayForThem #HumboldtStrong #HockeyIsFamily #GoNucks",NOT,looking hockey players of all agesabilities for our humboldt tribute game sunday 916 arrive 2pm dress participate in our opening ceremony contact lindsayclothier if you are interested
17798,#Conservatives #Brexit putting #Britain last.  Sending a chill down the spine of the #UK.,NOT,putting  last  sending a chill down the spine of the
71873,#Gamers go follow @USER on #Twitter and #twitch He is playing with @USER on #BlackOps4 #Blackout Please help and support them both on Twitter and twitch. Remember all #SupportForSupport and #SupportAllStreamers URL,NOT,go follow  on  and  he is playing with  on   please help and support them both on twitter and twitch remember all  and
30247,"#QuickTip: Find people already working in a company, or within the industry that you are interested in.  We know a lot of people! Send us your resume to info@USER or message us RIGHT NOW URL URL",NOT,find people already working in a company or within the industry that you are interested in  we know a lot of people send us your resume to info or message us right now
81150,#LiberalLogic If #Liberals get their way..... URL,NOT,if  get their way
46444,"#ArianaAsesina? Is that serious?! Holy shit, please your fucking assholes, don't blame someone for the death of other one. She is sad enough for today, don't you see? It isn't fault of none, he had an overdose and died. End. Stop wanting someone to blame, fuckers.",OFF,is that serious holy shit please your fucking assholes dont blame someone for the death of other one she is sad enough for today dont you see it isnt fault of none he had an overdose and died end stop wanting someone to blame fuckers
60587,@USER How is she hiding her ugly personality. She is the worst.,OFF,how is she hiding her ugly personality she is the worst
70569,......bitch what URL,OFF,bitch what
59200,"#Georgetown Classmate Says #Left Accuser is Absolutely NUTS""  URL ""Judge Kavanaugh""@USER @USER @USER #ABC #CBS #Democrats #Liberals #women #MondayMotivation #MondayMorning #veterans #law #MAGA #GOP #CNN #MSNBC #NBC #Moms #BlackWomen #BET""",NOT,classmate says  accuser is absolutely nuts   judge kavanaugh
30900,@USER @USER @USER Are you referring to how they lollygag with gun control as their kids get slaughtered in schools?,NOT,are you referring to how they lollygag with gun control as their kids get slaughtered in schools
44546,@USER @USER @USER @USER @USER @USER @USER @USER @USER I’m shocked to learn human traffickers had guns.  Some probably illegal too.  CA needs more gun control.  But don’t worry about the actual crime.  The pic of black guns is worse.,OFF,i’m shocked to learn human traffickers had guns  some probably illegal too  ca needs more gun control  but don’t worry about the actual crime  the pic of black guns is worse
53982,#WELOVESEUNGCHEOL @USER   I am happy and proud of the work you have done to train seventeen along with the other members. I see you and you are wonderful and incredible. I really love u ㅠㅠ 💕. URL,NOT,i am happy and proud of the work you have done to train seventeen along with the other members i see you and you are wonderful and incredible i really love u
37884,#Chequers is a violation of democracy !!  #StandUp4Brexit  @USER @USER @USER  The will of the people must be respected URL,NOT,is a violation of democracy         the will of the people must be respected
15079,"#Sessions Tells #Chicago: “If You Want More #Shootings, More #Death, Listen To #ACLU, #Antifa, #BlackLivesMatter” URL",NOT,tells  “if you want more  more  listen to   ”
51628,#Conservatives @USER - You're  a clown!  URL,OFF,youre  a clown
30899,*voice in my head while I transfer money to my credit card* “bullshit that I bought and have to pay for”,OFF,voice in my head while i transfer money to my credit card “bullshit that i bought and have to pay for”
99680,Levi Strauss has “never been afraid to take an unpopular stand to support a greater good.” '  What about when they shut down all manufacturing in America?  That wasn't even a news story when it happened. Maybe they're right; it wasn't unpopular.  URL,NOT,levi strauss has “never been afraid to take an unpopular stand to support a greater good”   what about when they shut down all manufacturing in america  that wasnt even a news story when it happened maybe theyre right it wasnt unpopular
38628,"@USER $500,000 for her wedding. Clinton's always know what's best.",NOT,500000 for her wedding clintons always know whats best
40110,#Kids Beating #Paraplegic #Trump #Boy!  #Left Teach Their #Children Hate Violence!  #schools #teachers #Democrats #Liberals #WalkAway #Moms #Mother #NEA #teachthemyoung #Christian #Catholic #Jews #Evangelicals #family #BlackWomen #BlackTwitter #Blacks #News #Media #Disabled #MAGA URL,OFF,beating      teach their  hate violence
50310,"0-9 : B-1, J-1, R-1, B-2, Q-2, B-3, BX-3, B-4, RB-4, Z-4, B-5, Q-5, B-6, H-6, B-7, H-7, UT-7, B-8 (20:59:36)",NOT,09  b1 j1 r1 b2 q2 b3 bx3 b4 rb4 z4 b5 q5 b6 h6 b7 h7 ut7 b8 205936
84101,"#AskAlly I only say that I adore you and you are a great person, please take care of yourself always❤️",NOT,i only say that i adore you and you are a great person please take care of yourself always
84876,"#DOJ employee resisters"" r looking up conservatives’ license plates, home addresses, legal details in LexisNexis 2give to Dem Socialists/Antifa-project Veritas.But don't worry, no govt in history has ever made political opponent lists and oppressed them🙄 URL",NOT,employee resisters r looking up conservatives’ license plates home addresses legal details in lexisnexis 2give to dem socialistsantifaproject veritasbut dont worry no govt in history has ever made political opponent lists and oppressed them
57425,#Kelly McParland: Latest floor-crosser is telling truths the Liberals don’t like hearing - URL URL,NOT,mcparland latest floorcrosser is telling truths the liberals don’t like hearing
83262,#GreatAwakening #QAnon #PatriotsUnited #WWG1WGA #AreYouAwake  WHEN YOU ARE AWAKE YOU SEE CLEARLY ❤️🧡💛💚  Check out this video URL URL,NOT,when you are awake you see clearly   check out this video
46777,"#BoycottLevis Since the late 1990s, Levi’s has used its name and resources to attack gun rights. In 1999, the company gave $100,000 to gun control group PAX, followed by a $250,000 donation in 2000 and another $100,000 in 2001. URL",NOT,since the late 1990s levi’s has used its name and resources to attack gun rights in 1999 the company gave 100000 to gun control group pax followed by a 250000 donation in 2000 and another 100000 in 2001
54053,Are you fucking serious?   URL,NOT,are you fucking serious
15998,*gets all the bitches*,OFF,gets all the bitches
62945,@USER @USER @USER I got in a pretty deep debate with my friend and she told me that latinos for Trump and blacks for Trump were paid supporters 😂 then I said you mean antifa are paid domestic terrorist and she said No they are  anti-fascist then I said they are the fascist are you kidding me?!,NOT,i got in a pretty deep debate with my friend and she told me that latinos for trump and blacks for trump were paid supporters  then i said you mean antifa are paid domestic terrorist and she said no they are  antifascist then i said they are the fascist are you kidding me
96457,#Antifa: Take note of how to protest with civility.   This is why socialism (aka communism) will never win. It is inherently evil and unsustainable. URL,OFF,take note of how to protest with civility   this is why socialism aka communism will never win it is inherently evil and unsustainable
85977,#gmm #roastmycat hi @USER  this is Fiona. She is about 10 weeks old. She falls asleep in weird places URL,NOT,hi   this is fiona she is about 10 weeks old she falls asleep in weird places
70841,@USER omg is he for real ?!?!!??????) this happened in peru like 40 years ago and the Inti devaluated so fucking much that they had to comoletely change the coin system because our money was worthless i-,OFF,omg is he for real  this happened in peru like 40 years ago and the inti devaluated so fucking much that they had to comoletely change the coin system because our money was worthless i
46139,"#Conservatism101   It's not about our disagreements with #Conservatives. Its that Conservatives can't debate honestly, and they have no integrity. Whatever gets them thru today, is all that matters to them. They're fundamentally dishonest people. URL",OFF,its not about our disagreements with  its that conservatives cant debate honestly and they have no integrity whatever gets them thru today is all that matters to them theyre fundamentally dishonest people
99009,#Halloween Sign If You Are Reading This #CreepingUp Behind You Wood Wall Decoration #tmtinsta #cwsigns  URL via @USER,NOT,sign if you are reading this  behind you wood wall decoration     via
66388,"#huniachiweek No matter what you are going through today or in the past few days, your situation is never permanent. God is going to change your life for good. Trust and Believe that He is able to. Please, Read... URL",NOT,no matter what you are going through today or in the past few days your situation is never permanent god is going to change your life for good trust and believe that he is able to please read
91217,@USER My only point of contention is this.  He decided to keep this group which has top end talent and also decided to hire hot trash Mike McCoy. Wilks hasn't even been able to get his defense to line up correctly. He is in over his head.,NOT,my only point of contention is this  he decided to keep this group which has top end talent and also decided to hire hot trash mike mccoy wilks hasnt even been able to get his defense to line up correctly he is in over his head
91994,And yet everyone seems to lack it URL,NOT,and yet everyone seems to lack it
58751,#MAGA   Expect more censorship URL,NOT,expect more censorship
80947,And apparently I'm committed to going to a new level since I used the key.  Well FUCK.  Curiosity killed the Cat(hy),OFF,and apparently im committed to going to a new level since i used the key  well fuck  curiosity killed the cathy
99253,#NE need to check out a dentist and find out if she is has a perfect work record? What about a child care facility? Now you can check online for all kinds of licensed professionals and it's free @ URL,NOT,need to check out a dentist and find out if she is has a perfect work record what about a child care facility now you can check online for all kinds of licensed professionals and its free
40386,@USER @USER @USER @USER Then why aren’t there so many shootings in Virginia?  Jacksonville shooter got his guns IN MARYLAND!! Among the poster children for gun control!  What good did that do?!  You’re full of crap.,OFF,then why aren’t there so many shootings in virginia  jacksonville shooter got his guns in maryland among the poster children for gun control  what good did that do  you’re full of crap
58742,#Amnesty_International: US is in violation of international human rights law by not passing stronger #gun_control URL via @USER URL,NOT,us is in violation of international human rights law by not passing stronger   via
39752,@USER Well she is Chuck Schumer's cousin or niece or something so she is obviously part of the DNC conspiracy against Nixon. Or part of the Deep State. Or a Zionist plot. Or 'Big comedy'. Or whatever the hell today's conspiracy theory is.,NOT,well she is chuck schumers cousin or niece or something so she is obviously part of the dnc conspiracy against nixon or part of the deep state or a zionist plot or big comedy or whatever the hell todays conspiracy theory is
25262,#GodsPraiseroom God keeps you even in the storms that may rock your boat - Let's all submit to His will after all he is the only one who really knows the end from the beginning URL,NOT,god keeps you even in the storms that may rock your boat  lets all submit to his will after all he is the only one who really knows the end from the beginning
17703,#Spaldo is my guy.  He is my godson,NOT,is my guy  he is my godson
98916,"#ANTIFA are bedfellows with The Democratic Socialists of America (DSA) who #JamesOKeefe has exposed as being inserted throughout government, attempting to bring down #America  #Trump #MAGA🇺🇸 #DeepState  URL",OFF,are bedfellows with the democratic socialists of america dsa who  has exposed as being inserted throughout government attempting to bring down
18709,#CNN ruthlessly continues #Fakenews onslot. Where's the honest analysis? Right here!  URL #tcot #CNN #NRA #massshooting #CNNISFAKENEWS #Conservatives #FakeNewsMedia #FakeNews #PBA #FakeNewsCNN,NOT,ruthlessly continues  onslot wheres the honest analysis right here
26026,#Brexit Barometer: Labour fails to capitalise as Conservatives fail to please; Kantar: nearly two thirds of the UK believe the government is handling Brexit negotations poorly.  URL,NOT,barometer labour fails to capitalise as conservatives fail to please kantar nearly two thirds of the uk believe the government is handling brexit negotations poorly
32190,@USER Antifa has TS level influence. It's scary.,OFF,antifa has ts level influence its scary
27550,"@USER I have three accounts. Two quasi-anonymous, and one completely anon. And if twitter ever bans one of the quasi-anon, I'll make two anon accounts and tweet the most insane shit. I will drown twitter in bullshit. If one of those is banned, I'll make even more.",OFF,i have three accounts two quasianonymous and one completely anon and if twitter ever bans one of the quasianon ill make two anon accounts and tweet the most insane shit i will drown twitter in bullshit if one of those is banned ill make even more
68539,#MAGA Alert : Joe Biden on #Trump Supporters: 'The Dregs Of Society' (VIDEO) URL via @USER,NOT,alert  joe biden on  supporters the dregs of society video  via
93643,$CERC is now Boyd's #1 stock. And he is the sole holder of the stock among hedge funds we track. URL,NOT,cerc is now boyds  stock and he is the sole holder of the stock among hedge funds we track
99120,"@USER @USER @USER @USER @USER @USER @USER @USER @USER @USER @USER @USER @USER @USER City of Chicago, Democrat run with some of the strictest gun control in the nation.""  😂 What's your point, #NotThatBright? URL",NOT,city of chicago democrat run with some of the strictest gun control in the nation   whats your point
24040,#Liberals are so pathetic!  INNOCENT UNTIL PROVEN GUILTY mean much?  #Democrats should look at their own party if they need a rapist to hang!  #KavanaughIsInnocent #WalkAwayFromDemocrats. #LiberalLies are straight from the Pitts of HELL 🔥 URL,OFF,are so pathetic  innocent until proven guilty mean much   should look at their own party if they need a rapist to hang     are straight from the pitts of hell
85436,"#Trump may be many things, but he is entertaining!!!! Thanks #twitter URL",NOT,may be many things but he is entertaining thanks
73516,"$10 Million reallocated from FEMA to ICE. This guy gives zero shits about anyone not named Trump. If you’re in the mid Atlantic, get out. Now. URL",OFF,10 million reallocated from fema to ice this guy gives zero shits about anyone not named trump if you’re in the mid atlantic get out now
88905,#FortniteBattleRoyale #XboxShare @USER   Please ban this cheating scum.  he is literally invisible URL,OFF,please ban this cheating scum  he is literally invisible
52955,"#I once read about the man who invented bulbs, he saw failure differently, it was 5000 new wayz of doing it differently..Now he is a genius#",NOT,once read about the man who invented bulbs he saw failure differently it was 5000 new wayz of doing it differentlynow he is a genius
33452,#2AUnfettered Repeal all gun control laws. If the government can use it then the people should be able to as well. URL,NOT,repeal all gun control laws if the government can use it then the people should be able to as well
13276,.. Good thing it was responsible US Marines..  I’m pretty sure a group of Antifa members wouldn’t be running that fast in that direction to help anyone let alone elder seniors..  Thank you @USER ..  We salute You❗️  @USER @USER  @USER URL,NOT,good thing it was responsible us marines  i’m pretty sure a group of antifa members wouldn’t be running that fast in that direction to help anyone let alone elder seniors  thank you    we salute you
26462,"#FordTheatre  Right on Cue, a GoFundMe acct has been set up for this person, the new #Liberals  mode of bribery and payoffs! @USER  Really should  investigate these GoFundMe as a  New outlet for  slush funds! #Comey, #McCabe, #Strzok",NOT,right on cue a gofundme acct has been set up for this person the new   mode of bribery and payoffs   really should  investigate these gofundme as a  new outlet for  slush funds
