id,tweet,subtask_a,tweet_cleaned
41078,"#CREW is an eminence front. It's a put-on. #MSM falls for fake issue and props up #political #hacktivists as experts."" URL #tcot #Emoluments #conservatives #emolumentsclause #Law #lawyer #MediaWatch #FakeNewsAlert #FakeNews #MediaBias""",NOT,is an eminence front its a puton  falls for fake issue and props up   as experts
44625,"#AuthorConfession Day 14: Which tree is your MC's favorite?   I tried to ask Lisette, and she responded with any tree that has flowers. I don't know what to do with her, she won't give me a straight answer. Usually, she's not this difficult, so I suspect she is teasing me. 😅💞 URL",NOT,day 14 which tree is your mcs favorite   i tried to ask lisette and she responded with any tree that has flowers i dont know what to do with her she wont give me a straight answer usually shes not this difficult so i suspect she is teasing me
21197,#Nattyanplaying AOZORA TRAIN - SiSH(She is so high),NOT,aozora train  sishshe is so high
12193,#ChristineBlaseyFord is only being harassed by members of the Antifa the radical arm of the Democratic Party funded by George Soros.  #VoteRedToSaveAmerica,OFF,is only being harassed by members of the antifa the radical arm of the democratic party funded by george soros
73484,#Antifa excellent idea URL,NOT,excellent idea
96283,"#IOU project has demonstrated a quality Whitepaper. If you are an ICO-investor, I'm strongly recommend that you explore it, at any rate you will please it. #ico #Crypto #tokensale URL URL",NOT,project has demonstrated a quality whitepaper if you are an icoinvestor im strongly recommend that you explore it at any rate you will please it
78289,#BlockTwitterAds until Twitter stops shadow banning conservatives.,NOT,until twitter stops shadow banning conservatives
29485,#KavanaughConfirmationHearings #TuesdayThoughts  the women who support #Kavenaugh should fill the hearing gallery. PACK it full so the disruptive liberals cant get in STAND in unison while Kavanaugh testifies *** SOLIDARITY !  cc: @USER @USER,NOT,the women who support  should fill the hearing gallery pack it full so the disruptive liberals cant get in stand in unison while kavanaugh testifies  solidarity   cc
67024,@USER Not sure what you guys call 'authoritarian left' does that include Gun Control groups or are they just the left?,NOT,not sure what you guys call authoritarian left does that include gun control groups or are they just the left
97430,#백현 #BAEKHYUN EXO x MLB 2018 F/W  @USER  🔗URL 🔗URL 🔗URL 🔗URL URL,NOT,exo x mlb 2018 fw
63985,"50 Cent Calls Out Joe Budden's Bullshit"" On Instagram URL URL",OFF,50 cent calls out joe buddens bullshit on instagram
65505,#POTUS #realdonaldtrump #GOP #LPnational #thedemocrats #QAnon #blacklivesmatter #Antifa #ISIS #DAVOS #California #FOXNEWS #CNN #WSJ #NYSE #WAKEUPAMERICA #MAGA #mypatriotsupply  You need this... 1/2   URL,NOT,you need this 12
29697,#NaomiOsaka folks. #USOpen The future is here and she is so adorable just as she is talented,NOT,folks  the future is here and she is so adorable just as she is talented
26695,"@USER @USER @USER @USER @USER @USER @USER @USER @USER @USER @USER @USER @USER @USER City of Chicago, Democrat run with some of the strictest gun control in the nation.""  😏 All the white supremacists running for office in 2018 as REPUBLICANS URL via @USER",NOT,city of chicago democrat run with some of the strictest gun control in the nation   all the white supremacists running for office in 2018 as republicans  via
86529,"#CallTheVoteAlready To the Democrats, this is a game. To the Conservatives, it's a fight for our way of life. End the game. Game over. Sessions, please do your job. We should all be ashamed of what we have allowed to happen. Pray like never before.",NOT,to the democrats this is a game to the conservatives its a fight for our way of life end the game game over sessions please do your job we should all be ashamed of what we have allowed to happen pray like never before
37332,#MAGA  .... sounds fair. URL,NOT,sounds fair
80612,#jiyoonfact  She is a huge fan of Beyonce and she wants to sing as well as her. She sang If I Were a Boy predebut.,NOT,she is a huge fan of beyonce and she wants to sing as well as her she sang if i were a boy predebut
89438,"#Conservatives you now know everything @USER has is being rejected by the #eu and the British people, Tory MP's need to step up because she's failed on #Brexit and the domestic agenda #MayMustGo #ChuckChequers URL",NOT,you now know everything  has is being rejected by the  and the british people tory mps need to step up because shes failed on  and the domestic agenda
68755,#MuskokaLakes mayoralty candidate Terry Ledger says she is running her mayoral campaign via social media only. We say this speaks volumes to the kind of behind-closed-doors mayor she plans to be. What do you say Muskoka? Give us your opinion. URL,NOT,mayoralty candidate terry ledger says she is running her mayoral campaign via social media only we say this speaks volumes to the kind of behindcloseddoors mayor she plans to be what do you say muskoka give us your opinion
53675,#GreatAwakening #QAnon #PatriotsUnited #WWG1WGA #AreYouAwake  WHEN YOU ARE AWAKE YOU SEE CLEARLY ❤️🧡💛💚  Check out this video URL URL,NOT,when you are awake you see clearly   check out this video
31195,@USER $6 million buyout and she could easily go to cable news if that’s she path she chooses . Good for her!,NOT,6 million buyout and she could easily go to cable news if that’s she path she chooses  good for her
20522,"#bb20 actually question why do people want Jc to win more than Angela? He has been way meaner, says the n word repeatly, makes fun of eating disorders, and sexually harasses houseguests.She is just as much as an underdog to win so dont use that excuse. #bb20  #tangela",OFF,actually question why do people want jc to win more than angela he has been way meaner says the n word repeatly makes fun of eating disorders and sexually harasses houseguestsshe is just as much as an underdog to win so dont use that excuse
52866,"#NewVideo 🍆🍑💦 Sex Toys, Anyone?  URL URL",NOT,sex toys anyone
65428,#BestWayToAWomansHeart DO NOT WAKE HER UP IF SHE IS NAPPING,NOT,do not wake her up if she is napping
94260,2018 not surprised it starts from the top!!!  Karma a bitch watch!!!! URL,OFF,2018 not surprised it starts from the top  karma a bitch watch
93256,@USER Be sure to send out the left's antifa thugs.,NOT,be sure to send out the lefts antifa thugs
78364,"#NoteToMyStalker n his empire: Remember one thing, you may own the incumbent central govt of India, but you do NOT own Nature.  If the life I, my ancestors and parents have lived is true, Nature will get you.  If you are trapping me or Nature is trapping you, only time will tell!",NOT,n his empire remember one thing you may own the incumbent central govt of india but you do not own nature  if the life i my ancestors and parents have lived is true nature will get you  if you are trapping me or nature is trapping you only time will tell
70324,Alright let me get right with God bc Mother Nature is like fuck humans URL,OFF,alright let me get right with god bc mother nature is like fuck humans
96847,@USER #Farticus maybe,NOT,maybe
89329,#Hillary and @ least 16 other #AngryDemocrats #WorldWarQ #WWG1WGA #MAGA #RedTsunami #AmericaFirst #WalkAway #Truth URL,OFF,and  least 16 other
40929,"#CodetrainQueens Rachel joined Codetrain in 2017 and helped to organize the Codetrain App Developer Bootcamp and trained as a front end developer. Currently the community manager, she is an ardent advocate for digital skills for youth, especially women. Keep shining, Rachel! URL",NOT,rachel joined codetrain in 2017 and helped to organize the codetrain app developer bootcamp and trained as a front end developer currently the community manager she is an ardent advocate for digital skills for youth especially women keep shining rachel
24798,#MovieFightsLive @USER @USER your all thinking it... you KNOW you are... URL,NOT,your all thinking it you know you are
99947,#BoycottLeviStrauss for supporting leftist gun control orgs. URL,NOT,for supporting leftist gun control orgs
94203,#YouAreMyIDOL  because you are my Idols boi's 💜😍 That'll NEVER change...you've taught me alot and continue to teach me things that help the most difficult little and big things in my life 👌👼 thank-you BBS!   @USER URL,NOT,because you are my idols bois  thatll never changeyouve taught me alot and continue to teach me things that help the most difficult little and big things in my life  thankyou bbs
11100,#Antifa is recruiting for a designated #terrorist organization URL,OFF,is recruiting for a designated  organization
83240,#Hypocrites #DemocratsHateAmerica #LiberalismIsAMentalDisorder EVERYTHING LIBERALS TOUCH TURNS TO ABSOLUTE SHIT... URL,OFF,everything liberals touch turns to absolute shit
14591,#NationalDayofEncouragement  #TwitterFamily  You’re amazing just the way you are 💟☮️ URL,NOT,you’re amazing just the way you are
66094,"#HappyRMday I bought pizza and chocolates, but I did not have enough money for a cake I plan to make a tradition, buy pizza on the birthday of my loved ones .. even if we are not acquainted and will never meet, you are still a close person to mе thank you i luv u 생일 축하합니다 URL",NOT,i bought pizza and chocolates but i did not have enough money for a cake i plan to make a tradition buy pizza on the birthday of my loved ones  even if we are not acquainted and will never meet you are still a close person to mе thank you i luv u
59164,"#republicans put WALLin budget..you are going to loose Pres.Trump followers. He is why U R there, so support him URL",NOT,put wallin budgetyou are going to loose prestrump followers he is why u r there so support him
90036,#Liberals are pushing a #gayagenda and #republicans are pushing a #zionistagenda,NOT,are pushing a  and  are pushing a
24047,#VaquitaMarina #SaveTheVaquita @USER  @USER  There are less than 12 #Vaquitas left!!!! She is extinguishing!!! Please help!!! Be their voice!l! URL,NOT,there are less than 12  left she is extinguishing please help be their voicel
81890,@USER @USER As I have said the media and money Soros with dip shit Waters is creating a civil war.,OFF,as i have said the media and money soros with dip shit waters is creating a civil war
26010,"#Liberals Dept of #Agriculture paid $100,000 for this presenter to shoot a bio security video  #Auspol #LNP #NSWpol #Springst #Qldpol @USER @USER @USER #LNPMemes #LNPWaste URL",NOT,dept of  paid 100000 for this presenter to shoot a bio security video
72037,#Texas Ted Cruz campaign is sending people solicitations disguised as official looking county summons. Elderly residents have been confused by the notice to appear. He is so skeezy.    URL,OFF,ted cruz campaign is sending people solicitations disguised as official looking county summons elderly residents have been confused by the notice to appear he is so skeezy
56312,"#Success #Health I will show you the best way to create your own exclusive, online 'traffic economy' so you are never short of qualified prospects and sales again URL URL",NOT,i will show you the best way to create your own exclusive online traffic economy so you are never short of qualified prospects and sales again
10860,@USER @USER lemme guess? gun control. didn’t anyone talk to you about this? I’m Canadian and even i know this #whyme,NOT,lemme guess gun control didn’t anyone talk to you about this i’m canadian and even i know this
38829,@USER @USER @USER @USER @USER @USER @USER @USER @USER @USER I really don't care that she's married to a black man - he is just as clueless as she is about real problems that black people are facing in America today.,NOT,i really dont care that shes married to a black man  he is just as clueless as she is about real problems that black people are facing in america today
78301,1 tf. He saw that shit. URL,OFF,1 tf he saw that shit
56599,@USER #FakeNewsMedia is the #EnemyOfThePeople!  They want to control YOUR minds by controlling what information you get and do not get.  The #1stAmendment may protect #elitist #propaganda but it does not legitimize it or make it palatable to an engaged public. URL,NOT,is the   they want to control your minds by controlling what information you get and do not get  the  may protect   but it does not legitimize it or make it palatable to an engaged public
94607,Anyone who finds M*neta's behavior funny can fuck off and die,OFF,anyone who finds mnetas behavior funny can fuck off and die
72531,#GoodMorningAmerica  #TuesdayMotivation #Thankyou #FatherGod the #Americanpeople will begin to see the #truth about our #governmentcorruption @USER @USER @USER #mediaCorruption #NoRedaction #DeclassifyFISA #Declassification completely #Obama #HillaryClinton #Lies #Leakers #liberals URL,OFF,the  will begin to see the  about our         completely
37214,"#StopTheBias #RedCensorship  My account was suspended for apparently promoting Hate Speech"" , yet #Antifa Terrorist Organizations are actively up and running.  Since your Customer Service refuses to reply to my emails, care to explain how this makes sense?  @USER URL",NOT,my account was suspended for apparently promoting hate speech  yet  terrorist organizations are actively up and running  since your customer service refuses to reply to my emails care to explain how this makes sense
84952,"#bepannaah  1- Bepannaah –  Hands down, Bepannaah tops the list because an adhiyal Aditya trying to convince a ziddi Zoya that she is in love with him is giving us lots of... URL",NOT,1 bepannaah –  hands down bepannaah tops the list because an adhiyal aditya trying to convince a ziddi zoya that she is in love with him is giving us lots of
98575,"@USER The difference between you and I as I stated before, and this inane asinine comment have solidified is I bring facts and truth, while all you have is lies and bullshit. Present a single shred of credible evidence to support a single thing you've just said. Lies is all you've got.",OFF,the difference between you and i as i stated before and this inane asinine comment have solidified is i bring facts and truth while all you have is lies and bullshit present a single shred of credible evidence to support a single thing youve just said lies is all youve got
58342,@USER Damn I felt this shit. Why you so loud lol,OFF,damn i felt this shit why you so loud lol
53914,"#MyProtege, a #k12 #Master #Teacher was very excited to report she is the proud owner and supporter of products made by @USER @USER #Bravo! #USOpen",NOT,a    was very excited to report she is the proud owner and supporter of products made by
76324,"-tsk stays.... Drop foto HAN JISUNG dong, please.... 😥",NOT,tsk stays drop foto han jisung dong please
18730,"10 years ago today, Taylor Swift released her smash hit ‘Love Story’. Quote this tweet telling the moment you first heard the song #10YearsOfLoveStory URL",NOT,10 years ago today taylor swift released her smash hit ‘love story’ quote this tweet telling the moment you first heard the song
39429,#MSNBC #Hardball @USER Bingo you are absolutely correct he cannot bring President Obama down. He can’t get over how President Obama humiliated him at the White House correspondents dinner and I can guarantee you that is a definite driver of his hate for President Obama,OFF,bingo you are absolutely correct he cannot bring president obama down he can’t get over how president obama humiliated him at the white house correspondents dinner and i can guarantee you that is a definite driver of his hate for president obama
72893,"@USER Yes, we are supposed to believe that Kavanaugh, who seemed to be a heavy drinker in high school, has perfect memory of everything he did, while she is mixed up."" Blame the victim.   He has been equivocating/misrepresenting himself, but he should be believed. Not! #StopKavanaugh""",NOT,yes we are supposed to believe that kavanaugh who seemed to be a heavy drinker in high school has perfect memory of everything he did while she is mixed up blame the victim   he has been equivocatingmisrepresenting himself but he should be believed not
18786,#CnnIsFakeNews @USER @USER you wonder why your ratings suck... #cnnisajoke #FakeNews #MAGA URL,OFF,you wonder why your ratings suck
61004,#Liberals Lying - Nothing new here Claim we’re on track to meet #emissions targets is false  URL  #Auspol #LNP #NSWpol #Springst #Qldpol #WApol @USER @USER @USER #LNPMemes URL,NOT,lying  nothing new here claim we’re on track to meet  targets is false
46603,"#Chefs, are you in need of some new pans? Find what you are looking for at URL We stock top brands such as Beka Chef, Mauviel and Woll. 🍳🥘🍲 #chef #restaurants URL",NOT,are you in need of some new pans find what you are looking for at  we stock top brands such as beka chef mauviel and woll
73236,@USER #BoycottTheNFL particularly the @USER,NOT,particularly the
35785,$b album definitely worth the fucking wait,OFF,b album definitely worth the fucking wait
84045,"3 days before BBC Radio 2’s Festival in a Day, they decide to tell us that their headline act isn’t coming anymore. Thanks a lot, now I’ve paid a fortune to see a tonne of acts who are shit and who are of no interest to me 😑👍🏻",NOT,3 days before bbc radio 2’s festival in a day they decide to tell us that their headline act isn’t coming anymore thanks a lot now i’ve paid a fortune to see a tonne of acts who are shit and who are of no interest to me
67049,"#JoeScarborough is a vile excuse for a journalist"". Here he is criticizing #Trump yet refuses to come clean about the death of an intern in his office. Stop talking about everyone else and start talking about YOUR INVOLVEMENT WITH #LORIKLAUSUTIS. @USER",OFF,is a vile excuse for a journalist here he is criticizing  yet refuses to come clean about the death of an intern in his office stop talking about everyone else and start talking about your involvement with
57804,@USER HIS FANS ARE HAPPY. HE SPREADS LOVE AND BECAUSE OF HIM I LEARNED TO APPRECIATE AND SUPPORT THE LGBTQ. I LOVE HIM  BECAUSE HE NEVER FAILED TO MAKE ME HAPPY. I LOVE HIM BECAUSE HE IS HARRY STYLES AND HARRY STYLES IS THE BEST.,NOT,his fans are happy he spreads love and because of him i learned to appreciate and support the lgbtq i love him  because he never failed to make me happy i love him because he is harry styles and harry styles is the best
82273,Ain’t nobody shit if you ask me... including myself.,OFF,ain’t nobody shit if you ask me including myself
68340,"#POWER #LESSONS  - There are certain testimonies that comes then rest comes and the strength of the wicked is removed. - When there is major vacuum in your life whether you are aware of it or not, its attracting the mockery.   #SEPTEMBER TO #REMEMBER #DAY2 URL",NOT,there are certain testimonies that comes then rest comes and the strength of the wicked is removed  when there is major vacuum in your life whether you are aware of it or not its attracting the mockery    to
78646,@USER - so long Jamule.,NOT,so long jamule
13582,"#MISSING: Imelda Algiers was last seen at about 3 p.m. Sunday.  She is about 5’04” tall, weighs about 110 pounds, and has white hair. It is unknown what Imelda was wearing. Imelda is diagnosed with Alzheimer’s Disease.  #WestBend URL",NOT,imelda algiers was last seen at about 3 pm sunday  she is about 5’04” tall weighs about 110 pounds and has white hair it is unknown what imelda was wearing imelda is diagnosed with alzheimer’s disease
36455,#MyUniqueHeritage I Get My Irish From My Dad Side Of the Family Since my Last Name is Irish Cause I’m Very Proud Of Being Irish☘️💚 URL,NOT,i get my irish from my dad side of the family since my last name is irish cause i’m very proud of being irish
98994,"#Travel #Movies and Unix #Fortune combined  Visit #Salisbury, see the sights, but wherever you go there you are, the same old you, why not travel as an international spy? Find yourself at the centre of a vast international conspiracy when you return home.   Recall Recall Recall.",NOT,and unix  combined  visit  see the sights but wherever you go there you are the same old you why not travel as an international spy find yourself at the centre of a vast international conspiracy when you return home   recall recall recall
92967,#SaveShadowhunters #MalecForever Read Mansikka's latest cause she is awesome. URL,NOT,read mansikkas latest cause she is awesome
70762,@USER $$$ well spent...panthers..Douch,NOT,well spentpanthersdouch
98216,"The Dregs of Society""... more LABELINGand DEHUMANIZING Conservatives.I suggest,WE, Conservatives keep OUR ammo dry and OUR guns loaded..If the Fascist Liberal Left THINK Conservatives WILL go quietly into internment camps or slaughtered in the streets they NEED a REALITY check. URL",OFF,the dregs of society more labelingand dehumanizing conservativesi suggestwe conservatives keep our ammo dry and our guns loadedif the fascist liberal left think conservatives will go quietly into internment camps or slaughtered in the streets they need a reality check
42113,#Sonntagsfrühstück in #Deutschland! #🇩🇪 Hand Drawn World teapots are the perfect addition to any breakfast table...#☕️ 🍞🥒No matter where in the world you are! 🙃✏️🌍💙 URL,NOT,in   hand drawn world teapots are the perfect addition to any breakfast table no matter where in the world you are
61889,#4theManyNotthefew we need a country that recognises everyone in society not pick the few and sod the rest like @USER Austeritity was only for the Working Class the very people you need to rely on the rich got richer off the backs of the poor DONT let the tories carry on,NOT,we need a country that recognises everyone in society not pick the few and sod the rest like  austeritity was only for the working class the very people you need to rely on the rich got richer off the backs of the poor dont let the tories carry on
30365,@USER Killary how does stricter gun control work. Looking at Chicago which has some of the strictest gun control laws in the country seems to have problems with shootings nearly everyday. Please explain that!,NOT,killary how does stricter gun control work looking at chicago which has some of the strictest gun control laws in the country seems to have problems with shootings nearly everyday please explain that
68518,"#Brexit is dead. Not because the other EU states won't cooperate, but because the Conservatives have no viable plan to keep it alive. We must have a new vote to carry on playing a central role in the EU, or be buried with Brexit. URL",NOT,is dead not because the other eu states wont cooperate but because the conservatives have no viable plan to keep it alive we must have a new vote to carry on playing a central role in the eu or be buried with brexit
37649,#Feinstein you cant say anything truthful.  You are a loers and liar. URL,OFF,you cant say anything truthful  you are a loers and liar
21394,#BoycottLeviStrauss Levi Strauss took a public stance against the Second Amendment and singled out pro-2A customers.  Read more about Levi's anti-gun initiatives here: URL URL,NOT,levi strauss took a public stance against the second amendment and singled out pro2a customers  read more about levis antigun initiatives here
14582,#LifeIsButepu when you have sex anytime you want but you are single,OFF,when you have sex anytime you want but you are single
88487,#WFMMC A very talented team because you are such a prestigious project. An excellent project to promote big market projects. #WFMMC #IcO #Ekolong #Sripuptruzman,NOT,a very talented team because you are such a prestigious project an excellent project to promote big market projects
21714,#Celebrations are off in #Germany for the #Germans ..  Yeah kind of expected this to happen across the western world over #SecurityFears  #MAGA #MEGA #MBGA #MCGA #Conservatives #Patriots URL,NOT,are off in  for the    yeah kind of expected this to happen across the western world over
50821,"#Clinton #Monsanto☠️#Bayer #BigPharma #Roundup #glyphosate #GMOs  '... in an age where progressives demand full transparency on all the issues that matter to them most — immigration, gay marriage, gun control and so on — Hillary ... on the wrong side....'URL",NOT,in an age where progressives demand full transparency on all the issues that matter to them most — immigration gay marriage gun control and so on — hillary  on the wrong side
57793,"#6, Sheriff Wayne Ivey. CSPOA? - Yes, it seems he's in as well. URL",NOT,sheriff wayne ivey cspoa  yes it seems hes in as well
55400,"#CCOT is one of the leading conservative hashtags. Get your tweet read, add #CCOT! Christian Conservatives On Twitter #Christians #Conservatives #Libertarians #Evangelicals #Catholics #Charismatics #Nondenominatinal #SpiritFilled #tlot #tcot #Hannity  #TeaParty #MAGA #TrumpTrain URL",NOT,is one of the leading conservative hashtags get your tweet read add  christian conservatives on twitter
59751,#Nigeria #Naija #9ja 'You are the most incompetent leader in Nigeria’s history' – Atiku blasts Buhari URL By championnewsng Via URL,OFF,you are the most incompetent leader in nigeria’s history – atiku blasts buhari  by championnewsng via
66470,#nowplaying Death Cab For Cutie / You Are A Tourist / Codes And Keys [@USER ♫  URL,NOT,death cab for cutie  you are a tourist  codes and keys
92215,"#Emmys  Well, most of those ex-crackheads are liberals and Democrats; so ...",OFF,well most of those excrackheads are liberals and democrats so
11122,"#Conservatives Are #Outraged"" Because #TheyKnowNothing, Especially About @USER URL",NOT,are  because  especially about
